siren,nom_officiel,nature_juridique,tranche_effectif,activite_principale,categorie,etat,region,departement
786119164,FEDER DEPART SYNDICATS EXPLOIT AGRICOLES,8450,11,94.12Z,PME,A,52,49
775655699,APEI DE THONON ET DU CHABLAIS,9230,32,88.10C,ETI,A,84,74
897575155,FONDS DE DOTATION MAC DISH,9300,NN,94.99Z,,A,11,75
340183037,ACTIVITES MULTIPLES D'INSERTION,9220,22,88.10C,PME,A,44,88
326942836,WEC FRANCE HUMANITAIRE (AEM WEC),9260,01,94.91Z,PME,A,44,68
/tmp/dca_xmls/xml/2023/3112/999999499_31122023_rectif1.xml,,,,,,,,
341607612,ASSOCIATION GARANTIE LOGEMENT (AGL),9220,11,88.99B,PME,A,28,76
331945071,MAISON POLYVAL SOCIALE ST EXUP,9220,11,90.01Z,PME,A,11,78
778542167,FEDER HTE SAONE POUR PECHE ET PROTEC AQU,9220,03,93.12Z,PME,A,27,70
314592098,OFFICE MUNICIPAL DE LA CULTURE,9220,12,94.99Z,PME,A,11,94
879176741,DES ENFANTS ET DES ARBRES,9220,02,94.99Z,PME,A,11,92
509537072,INITIATIVE PAYS SALONAIS (IPS),9220,03,94.99Z,PME,A,93,13
402847107,FED BDR PECHE MILIEU AQUATIQUE,9220,03,94.99Z,PME,A,93,13
951979137,AVOCAT CONGO REPUBLIQUE DEMOCRATIQUE DIPLOMATE AMBASSADOR BIENVENU YAKITE MOUKOUMANI TSHISEKEDI TSHILOMBO,3290,NN,69.10Z,PME,C,,
891979007,CLERMONT-MASSIF CENTRAL 2028,9220,11,94.99Z,PME,C,84,63
300231446,CAMPUS DE GROISY,9220,21,85.32Z,PME,A,84,74
316561141,ASSOCIATION BOIFFIERS BELLEVUE,9220,12,88.99B,PME,A,75,17
951861616,NEW YORK UNITED STATES OF AMERICA C.I.A LIEUTENANT'S COMMANDANT OFFICER'S OLIVIER MOUKOUMANI YAKETE KABILA KABANGE OF NE,3290,NN,69.10Z,PME,C,,
439124058,CPIE TERRES TOULOUSAINES ASSOCIATION REFLETS (CPIE TT),9220,11,94.99Z,PME,A,76,31
891822264,FONDS MG,9300,01,94.99Z,PME,A,53,35
829489954,ORGANISME DE FONCIER SOLIDAIRE DE LA METROPOLE LILLOISE (OFSML),9220,01,94.99Z,PME,A,32,59
829035583,INNOV'AMIENS (INNOV'A),9220,02,94.99Z,PME,A,32,80
838810661,ASSOCIATION PLATEFORME TERRITORIALE D'APPUI DANS LE DEPARTEMENT DES YVELINES (APTA 78),9220,03,94.12Z,PME,A,11,78
319763009,ASSOCIATION VALLEE AUX RENARDS ANIMATION,9220,12,88.99B,PME,A,11,94
782886709,VACANCES BLEUES ASSOCIATION (VBA),9220,01,79.12Z,ETI,A,93,13
494578206,ASS DEP INFORMATION LOGEMENT YVELINES (ADIL 78),9220,03,94.99Z,PME,A,11,78
786210781,OGEC INSTITUTION ST LOUIS,9220,22,85.31Z,PME,A,52,49
402827752,COMITE DES OEUVRES SOCIALES,9220,NN,94.99Z,PME,A,84,38
488527326,AGENCE NOUVELLE DES SOLIDARITES ACTIVES,9220,12,94.99Z,PME,A,11,75
313609125,DE GESTION DES AIDES AUX FAMILLES ET AUX PERSONNES AGEES RESIDENCES ET SERVICES A DOMICILE (AGAFPA RESIDENCES ET),9220,32,88.10A,PME,A,93,13
999999839,,,,,,,,
892022484,FONDS DE DOTATION SAINT-JOSEPH,9300,NN,94.99Z,,A,75,64
918454125,FONDS DE DOTATION MY KER (FDMK),9300,NN,88.99B,,A,53,35
429626237,AGENCE LOCALE DE L'ENERGIE ET DU CLIMAT GRAND LYON (ALEC GRAND LYON),9220,12,94.99Z,PME,A,84,69
951854900,CHERUBIN MOUKOUMANI YAKETE KABILA KABANGE NEW YORK UNITED STATES OF AMERICA LAWYER DIRECTOR,3290,NN,69.10Z,PME,C,,
844690941,CENTRE REGIONAL DE COORDINATION DES DEPISTAGES DES CANCERS DE LA REGION AUVERGNE-RHONE-ALPES,9220,22,94.99Z,PME,A,84,42
951985241,CONGO REPUBLIQUE DEMOCRATIQUE DIPLOMATE AMBASSADOR KAYLIAN MOUKOUMANI YAKETE TSHISEKEDI TSHILOMBO,3290,NN,69.10Z,PME,C,,
326923141,ASS GEST CENT SOC MOUL A VENT,9220,12,88.99B,PME,A,84,69
407711241,QUATRE 4.0,9260,02,90.01Z,PME,A,44,67
952080984,NEW YORK SOCIETE AVOCAT FELIX ANTOINE TSHISEKEDI TSHILOMBO AND OLIVIER MOUKOUMANI YAKETE TSHISEKEDI TSHILOMBO UNITED STA,3290,NN,69.10Z,PME,C,,
951418748,IRELAND LONDONDERRY BT474LW SOCIETE EXPERT JUDICIAIRE AVOCAT KABIKA MOUKOUMANI YAKETE KABILA KABANGE,3290,NN,69.10Z,PME,C,,
409164720,LES JARDINS DE L'ESPERANCE,9220,12,88.99B,PME,A,93,13
848277232,FONDS DE DOTATION CORDOUAN,9300,NN,94.99Z,,A,75,33
794286336,FACE MAINE ET LOIRE,9220,03,94.99Z,PME,A,52,49
835351222,FONDS DE DOTATION DEVELOPPONS NOS BOUTIERES,9300,NN,94.99Z,,A,84,07
324805696,COMIT EDUC SANTE SEINE ST DENI,9220,03,94.99Z,PME,A,11,93
323448670,MAXI AIDE GRAND LYON,9220,32,88.10A,PME,A,84,69
918975749,FONDS DE DOTATION MARTHE DESANGES,9300,NN,94.99Z,,C,52,49
/tmp/dca_xmls/xml/2023/3112/830497939_31122023_rectif1.xml,,,,,,,,
329705354,MISSION LOCALE INSERT JEUNES ANNECIENS,9220,12,84.13Z,PME,A,84,74
353514540,CLUB PROVENCE TIR,9220,02,94.99Z,PME,A,93,13
812809226,FONDS DE DOTATION ASSAMI,9300,NN,94.99Z,,A,93,13
775508179,FONDATION VAL DE LOIRE,9300,22,87.90A,PME,A,24,45
978211415,ROI ABDULLAH II BIN AL-HUSSEIN DE JORDANIE EMIRATES ARABE ET SA DEUXIEME EPOUSE KABIKA MOUKOUMANI YAKETE KABILA KABANGE,3290,NN,69.10Z,PME,C,,
951582493,LIEUTENANT'S COMMANDANT OFFICER'S SCOTT JACKSON TRAVIS WALKER KABILA KABANGE UNITED STATES OF AMERICA DEPARTMENT OF DEFE,3290,NN,69.10Z,PME,C,,
410145502,ASSOCIATION CULTUELLE DE L'EGLISE PROTESTANTE LUTHERO-REFORMEE DE TOULON (EPLRT),9220,01,94.91Z,PME,A,93,83
977778661,CONGO REPUBLIQUE DEMOCRATIQUE SOCIETE MINIERE DE CHARBON BUSINESS OWNER KABIKA MOUKOUMANI,3290,NN,69.10Z,PME,C,,
328770722,MAISON RETRAITE SAINTE MARIE,9220,21,87.10A,PME,A,28,61
400139697,LA FARANDOLE DE MANIGOD,9220,11,88.91A,PME,A,84,74
778954768,ASSOCIATION CENTRE SOCIO-CULTUREL PAPIN,9260,21,88.91A,PME,A,44,68
327167474,CENTRE SOCIAL LO SOLAN,9220,21,88.99B,PME,A,75,64
418419438,ABEILLES AIDE ET ENTRAIDE (AAE),9221,22,78.30Z,PME,A,11,91
380425967,UNION DEP ASSOCIATION FAMILIALES (UDAF),9220,21,94.99Z,PME,A,76,11
802555839,MAISON INTERCOMMUNALE D'INSERTION / EMPLOI DU VAL MAUBUEE (M2IE),9220,21,85.59B,PME,A,11,77
951328459,AVOCAT DIPLOMATE AMBASSADOR TYRON MOUKOUMANI YAKETE KABILA KABANGE SOCIETE EXPERT JUDICIAIRE,3290,NN,69.10Z,PME,C,,
309675205,SECOURS POPULAIRE FRANCAIS,9220,12,88.99B,PME,A,84,63
780691895,ASSOCIATION LES COMPAGNONS - E.S.A.T.,9220,22,88.10C,PME,A,28,14
780005237,SECOURS POPULAIRE FRANCAIS (SPF),9260,02,88.99B,PME,A,44,57
378745335,CENTRE REGIONAL INFORMATION JEUNESSE REUNION (CRIJ),9220,11,94.99Z,PME,A,04,974
999999570,,,,,,,,
419874573,PREVEN RISQU ORIENT SOCIAL ECHANG SERING (PROSES),9220,12,88.99B,PME,C,11,93
951861343,NEW YORK UNITED STATES OF AMERICA LIEUTENANT'S COMMANDANT OFFICER'S KABIKA MOUKOUMANI YAKETE KABILA KABANGE OF NEW YORK,3290,NN,69.10Z,PME,C,,
952000321,AVOCAT KABIKA MOUKOUMANI TSHISEKEDI TSHILOMBO ET AVOCAT FELIX ANTOINE TSHISEKEDI TSHILOMBO NEW YORK UNITED STATES OF AME,3290,NN,69.10Z,PME,C,,
779221639,SYNDICAT CGT MICHELIN,8410,01,94.20Z,PME,A,84,63
951581867,LIEUTENANT'S COMMANDANT OFFICER'S TIMOTHY ROOSE THOMAS KABILA KABANGE UNITED STATES OF AMERICA DEPARTMENT OF DEFENSE,3290,NN,69.10Z,PME,C,,
782815559,ASSOCIATION DE L'AIDE FAMILIALE POPULAIRE DE PROVENCE (AAFP PROVENCE),9220,21,88.10A,PME,A,93,13
442213955,UNE TERRE CULTURELLE,9220,11,94.99Z,PME,A,93,13
/tmp/dca_xmls/xml/2023/3112/892825829_31122023_rectif1.xml,,,,,,,,
951972140,NEW YORK UNITED STATES OF AMERICA C.I.A LIEUTENANT'S COMMANDANT CHIEF TYRON MOUKOUMANI YAKETE KABILA KABANGE  NEW YORK U,3290,NN,69.10Z,PME,C,,
445014905,ASSOCIATION DE LA MAISON DE LA PLAINE,9220,11,94.99Z,PME,A,11,95
